"","TopCut_highestMinuslogP_any","maximum_MinuslogP_any","sum_MinuslogP_any","times_significant_any","FirstTopCut_significant_any","PEBBA_score_any"
"Transcriptional activity of SMAD2slashSMAD3:SMAD4 heterotrimer",100,1.07448159118659,9.30088828805821,0.0689655172413793,100,0.329262633532621
"Transcriptional regulation by small RNAs",100,0.546132117656936,2.56193438298255,0,0,0.210407147166335
"Transcriptional regulation of pluripotent stem cells",100,0.510888143797809,3.08302614932585,0,0,0.200018755423244
"Transcriptional regulation of white adipocyte differentiation",250,0.168979222082689,1.28186192908371,0,0,0.0602344776977508
"Transcription_Coupled Nucleotide Excision Repair TC_NER",500,0.79134497644332,8.41081908604823,0.0689655172413793,100,0.168959740267483
"Transcription of the HIV genome",100,0.260955983916012,2.03907780124063,0,0,0.11484258744454
"Transferrin endocytosis and recycling",250,0.38177606788047,2.87349344716968,0,0,0.122950417629062
"trans_Golgi Network Vesicle Budding",150,0.539134784481496,3.21720751924221,0,0,0.18732364864337
"Translation initiation complex formation",100,0.816096889012489,10.5340869424808,0.0689655172413793,100,0.278922966333238
"Translesion Synthesis by POLH",100,0.981587433318052,7.01460645311508,0.0344827586206897,100,0.312642104930049
"Translesion synthesis by POLI",100,0.981587433318052,7.01460645311508,0.0344827586206897,100,0.312642104930049
"Translesion synthesis by POLK",100,0.981587433318052,7.01460645311508,0.0344827586206897,100,0.312642104930049
"Translesion synthesis by REV1",100,0.981587433318052,7.01460645311508,0.0344827586206897,100,0.312642104930049
"Translesion synthesis by Y family DNA polymerases bypasses lesions on DNA template",100,0.755851745898354,3.94177590287065,0.0344827586206897,100,0.265194772220791
"Translocation of GLUT4 to the plasma membrane",400,0.178164796397513,1.51531959107007,0,0,0.0543984967477977
"Translocation of ZAP_70 to Immunological synapse",250,0.927092199990058,9.96606192458874,0.0689655172413793,250,0.234120431512252
"Transport of inorganic cationsslashanions and amino acidsslasholigopeptides",600,0.0900521211867342,0.605036188688651,0,0,0.0249649818050713
"Transport of Mature mRNA derived from an Intron_Containing Transcript",100,0.525630895263083,2.04146514523071,0,0,0.204408863703562
"Transport of Mature mRNA Derived from an Intronless Transcript",800,0.0159465516172252,0.0776703074823896,0,0,0.00413226581303787
"Transport of Mature mRNAs Derived from Intronless Transcripts",800,0.0159465516172252,0.0776703074823896,0,0,0.00413226581303787
"Transport of Mature Transcript to Cytoplasm",100,0.506973993019915,1.87182954179681,0,0,0.198842282657555
"Transport of Ribonucleoproteins into the Host Nucleus",1000,0.0124637173877411,0.0705055421359754,0,0,0.00297586272828358
"Transport of the SLBP Dependant Mature mRNA",1300,0.00334374202348208,0.0105571556290201,0,0,0.000724811807339429
"Transport of the SLBP independent Mature mRNA",1300,0.00334374202348208,0.0105571556290201,0,0,0.000724811807339429
"Transport of vitamins nucleosides and related molecules",400,0.152596462510915,0.993290226500737,0,0,0.0471746402653203
"TRIF_mediated TLR3slashTLR4 signaling",250,0.744477267238552,6.71326215487765,0.0344827586206897,250,0.203405361190755
"Triglyceride Biosynthesis",950,0.0194092751804427,0.106532229819204,0,0,0.0047087587535718
"Tristetraprolin TTP ZFP36 binds and destabilizes mRNA",850,0.258022958480878,2.60218397423373,0,0,0.0580829785078931
"tRNA Aminoacylation",1450,0.95889106707707,11.6495902161607,0.103448275862069,1250,0.128264731123221
"tRNA modification in the nucleus and cytosol",500,0.15778250936353,1.22729744097202,0,0,0.0451055090677732
"tRNA processing in the nucleus",100,0.347278462171478,1.60807358705139,0,0,0.146695731444027
"TRP channels",100,0,0,0,0,0
"Ubiquitin_dependent degradation of Cyclin D",100,0.561863803665629,4.79296525528645,0,0,0.214927283095772
"Ubiquitin_dependent degradation of Cyclin D1",100,0.561863803665629,4.79296525528645,0,0,0.214927283095772
"Ubiquitin Mediated Degradation of Phosphorylated Cdc25A",100,0.561863803665629,4.79296525528645,0,0,0.214927283095772
"Unblocking of NMDA receptor glutamate binding and activation",100,0,0,0,0,0
"Unfolded Protein Response UPR",100,0.48496938045573,2.35694123327118,0,0,0.192141975289757
"Uptake and actions of bacterial toxins",100,0.488160563121803,3.70571860264155,0,0,0.193122840589254
"Vasopressin regulates renal water homeostasis via Aquaporins",100,0,0,0,0,0
"VEGFR2 mediated vascular permeability",250,0.211302971385804,1.3992423233963,0,0,0.0737934868548866
"Vif_mediated degradation of APOBEC3G",100,0.546132117656936,5.10537321319788,0,0,0.210407147166335
"Viral Messenger RNA Synthesis",100,0.368730963013283,2.11366367698854,0,0,0.154194272757742
"Viral mRNA Translation",1500,2.37017944464661,33.1642629194156,0.896551724137931,100,0.186033068949109
"Visual phototransduction",100,0.424952190509967,2.15812925061694,0,0,0.173099478861469
"Voltage gated Potassium channels",550,0.382615816937704,2.61068888758256,0,0,0.0950389694262449
"Vpr_mediated nuclear import of PICs",1000,0.010162116849068,0.0607914693331135,0,0,0.00242911641805554
"Vpu mediated degradation of CD4",100,0.552209655930559,4.68987894989198,0,0,0.212161821362454
"VxPx cargo_targeting to cilium",300,0.162696616905403,1.25029672988448,0,0,0.0549590880458202
"WNT5A_dependent internalization of FZD4",500,0.126486245255352,0.736855768658168,0,0,0.0367154617498198
"WNT ligand biogenesis and trafficking",100,0.634835156624838,3.73356276964752,0,0,0.234988574063733
"XBP1S activates chaperone genes",500,0.0964551708113131,0.726986526585877,0,0,0.0284139260300256
"Xenobiotics",100,0,0,0,0,0
"YAP1_ and WWTR1 TAZ_stimulated gene expression",250,0.211302971385804,1.7470571715514,0,0,0.0737934868548866
"ZBP1DAI mediated induction of type I IFNs",250,0.207473504489137,1.66903334431204,0,0,0.0725901393427106
"Zinc transporters",400,0.153909197122722,1.25163861618862,0,0,0.0475500442293815
